{
  "$schema": "https://json-schema.org/draft/2020-12/schema",
  "title": "Roster",
  "description": "Roster: a human authors it; the dispatcher reads it. Precedence, lowest to highest: scripts/cmux/roster.default.json, then the user-level roster.json under ~/.claude/dev-team, then the project-level roster.json under <project>/.claude/dev-team, then a session override (RESERVED — no command exposes it yet). Frontmatter in agents/*.md is NOT a precedence layer in cmux mode; it stays authoritative for subagent/workflow mode and supplies the role-prompt body. Schema evolution: every file carries schema_version, starting at 1. A reader that encounters a schema_version higher than the one it knows REFUSES the document — it never best-efforts; the validator reports this as a distinctly named schema_version_too_new violation. Adding a value to an enum bumps schema_version if and only if some consumer branches on that enum with a documented default or else path. No bump: tools, profile.allow grants, permission_mode, isolation, agent, return.kind. Bump: outcome, level, escalate_to, postcondition. When in doubt, bump.",
  "type": "object",
  "required": ["schema_version", "tools", "defaults", "profiles", "roles"],
  "additionalProperties": false,
  "properties": {
    "schema_version": { "type": "integer", "const": 1 },
    "tools": { "type": "array", "items": { "type": "string", "enum": ["Read", "Edit", "Write", "Glob", "Grep", "Bash"] }, "uniqueItems": true, "minItems": 1 },
    "defaults": {
      "description": "Deliberately no `model`: model is required on every role, which removes an either/or the keyword budget cannot express.",
      "type": "object",
      "required": ["agent", "timeout_s", "max_gate_blocks", "max_turns"],
      "additionalProperties": false,
      "properties": {
        "agent": { "type": "string", "enum": ["claude"] },
        "timeout_s": { "type": "integer", "minimum": 60, "maximum": 86400 },
        "icon": { "type": "string", "pattern": "^[a-z0-9-]{1,32}$", "description": "cmux pane icon" },
        "max_gate_blocks": { "type": "integer", "minimum": 0, "maximum": 10 },
        "max_turns": { "type": ["integer", "null"], "minimum": 1, "description": "null means no cap" },
        "effort": { "type": "string", "enum": ["low", "medium", "high", "xhigh"] }
      }
    },
    "profiles": {
      "description": "Keys are profile names. No `properties` node: this is an open-keyed map whose value shape is fixed by additionalProperties.",
      "type": "object",
      "additionalProperties": {
        "description": "Profile: `allow` holds agent-neutral capability tokens, never permission-rule strings — the builder owns every literal rule string. Tool-name denies and the tool set are invariants hoisted out of profiles. `postcondition_ignore` globs filter `git status --porcelain` output and are therefore repo-relative with no leading / and no .. segment. Deliberately absent, and their absence IS the enforcement: no `deny` key, no `tools` key, no `disable_slash_commands` key.",
        "type": "object",
        "required": ["description", "permission_mode", "allow", "postcondition"],
        "additionalProperties": false,
        "properties": {
          "description": { "type": "string", "pattern": "\\S" },
          "permission_mode": { "type": "string", "enum": ["dontAsk"] },
          "allow": { "type": "array", "items": { "type": "string", "enum": ["returns_write", "signals_append", "worktree_write", "validation_commands"] }, "uniqueItems": true, "minItems": 2 },
          "postcondition": { "type": "string", "enum": ["clean", "changes_expected"] },
          "postcondition_ignore": { "type": "array", "items": { "type": "string", "pattern": "^(?!/)(?!.*(^|/)\\.\\.(/|$)).+$" }, "description": "Omission means [] (prose default, no `default` keyword)." }
        }
      }
    },
    "roles": {
      "description": "Keys are role names. No `properties` node: this is an open-keyed map whose value shape is fixed by additionalProperties.",
      "type": "object",
      "additionalProperties": {
        "description": "Role.",
        "type": "object",
        "required": ["pane", "profile", "isolation", "model", "doc_tab", "return"],
        "additionalProperties": false,
        "properties": {
          "pane": { "type": "boolean" },
          "profile": { "type": "string", "pattern": "\\S", "description": "Must be a key of `profiles`." },
          "isolation": { "type": "string", "enum": ["worktree", "primary"] },
          "model": { "type": "string", "pattern": "\\S", "description": "Validated against the shared MODEL_ALIASES whitelist or /^claude-/ by test, not by regex here." },
          "agent": { "type": "string", "enum": ["claude"] },
          "effort": { "type": "string", "enum": ["low", "medium", "high", "xhigh"] },
          "timeout_s": { "type": "integer", "minimum": 60, "maximum": 86400 },
          "max_turns": { "type": ["integer", "null"], "minimum": 1 },
          "doc_tab": { "type": "boolean" },
          "return": {
            "type": "object",
            "required": ["kind"],
            "additionalProperties": false,
            "properties": {
              "kind": { "type": "string", "enum": ["json", "markdown"] },
              "schema": { "type": "string", "pattern": "^[a-z0-9.-]+\\.schema\\.json$", "description": "Plugin-root-relative filename. Required when kind is json." },
              "required_sections": { "type": "array", "items": { "type": "string", "pattern": "\\S" }, "description": "Used when kind is markdown." },
              "verdict_block": { "type": "boolean", "description": "When true, the role's Verdict section must carry exactly one fenced json block matching {verdict, findings}, enforced by return-lint.mjs (not by this schema); prose default false." }
            }
          }
        }
      }
    }
  }
}
